{
  "id": "title-sequence",
  "name": "Cinematic title sequence",
  "deliverable_type": "title_sequence",
  "status": "proposed",
  "description": "Credits and title cards over slow camera pushes, letterboxing and grain.",
  "location": "pending:templates/projects/title-sequence",
  "stages": {
    "research": "skip",
    "storyboard": "required",
    "narration": "optional",
    "music": "optional",
    "captions": "optional"
  },
  "default_style": "cinematic-dark",
  "default_formats": [
    "landscape"
  ],
  "compositions": [],
  "effects": [
    "parallax-camera",
    "tracking-reveal",
    "grain-boil"
  ],
  "suitable_for": [
    "film openers",
    "event openers"
  ],
  "validation_steps": [
    "Build a starter composition under templates/projects/title-sequence and validate it like the experimental templates."
  ],
  "tags": [
    "template",
    "proposed",
    "title-sequence"
  ],
  "metadata": {
    "author": "MotionLab",
    "created_at": "2026-10-30",
    "updated_at": "2026-10-30"
  }
}
