{
  "id": "brand-logo-resolve",
  "name": "Brand / logo resolve",
  "deliverable_type": "brand_logo",
  "status": "proposed",
  "description": "Shapes assemble or morph into a supplied logo mark, then hold with a tagline.",
  "location": "pending:templates/projects/brand-logo-resolve",
  "stages": {
    "research": "skip",
    "storyboard": "required",
    "narration": "optional",
    "music": "optional",
    "captions": "optional"
  },
  "default_style": "editorial-light",
  "default_formats": [
    "landscape",
    "square",
    "portrait"
  ],
  "compositions": [],
  "effects": [
    "object-assembly",
    "shape-morph",
    "stroke-draw"
  ],
  "suitable_for": [
    "logo stings",
    "brand intros"
  ],
  "validation_steps": [
    "Build a starter composition under templates/projects/brand-logo-resolve and validate it like the experimental templates."
  ],
  "tags": [
    "template",
    "proposed",
    "brand-logo"
  ],
  "metadata": {
    "author": "MotionLab",
    "created_at": "2026-10-30",
    "updated_at": "2026-10-30"
  }
}
